{
  "$schema": "https://json-schema.org/draft/2020-12/schema",
  "$id": "https://obtuse.ai/schemas/dumbmoney/core-runner-config.v1.schema.json",
  "title": "DumbMoney Core public runner configuration",
  "type": "object",
  "additionalProperties": false,
  "required": [
    "schema",
    "data_root",
    "policy_path",
    "readiness_path",
    "core_public_key_path",
    "fund_lock_path",
    "service_manifest_path",
    "release_manifest_path",
    "bind_port",
    "release_id",
    "risk_policy_sha256",
    "core_public_key_sha256",
    "fund_lock_sha256",
    "service_manifest_sha256",
    "readiness_ttl_seconds",
    "processing_interval_milliseconds",
    "credential_targets",
    "role_public_keys_base64url"
  ],
  "properties": {
    "schema": {
      "const": "dumbmoney.core-runner-config.v1"
    },
    "data_root": {
      "$ref": "#/$defs/nonempty_string"
    },
    "policy_path": {
      "$ref": "#/$defs/nonempty_string"
    },
    "readiness_path": {
      "$ref": "#/$defs/nonempty_string"
    },
    "core_public_key_path": {
      "$ref": "#/$defs/nonempty_string"
    },
    "fund_lock_path": {
      "$ref": "#/$defs/nonempty_string"
    },
    "service_manifest_path": {
      "$ref": "#/$defs/nonempty_string"
    },
    "release_manifest_path": {
      "$ref": "#/$defs/nonempty_string"
    },
    "bind_port": {
      "type": "integer",
      "minimum": 0,
      "maximum": 65535
    },
    "release_id": {
      "$ref": "#/$defs/nonempty_string"
    },
    "risk_policy_sha256": {
      "$ref": "#/$defs/sha256"
    },
    "core_public_key_sha256": {
      "$ref": "#/$defs/sha256"
    },
    "fund_lock_sha256": {
      "$ref": "#/$defs/sha256"
    },
    "service_manifest_sha256": {
      "$ref": "#/$defs/sha256"
    },
    "readiness_ttl_seconds": {
      "type": "integer",
      "minimum": 10,
      "maximum": 120
    },
    "processing_interval_milliseconds": {
      "type": "integer",
      "minimum": 100,
      "maximum": 60000
    },
    "credential_targets": {
      "type": "object",
      "additionalProperties": false,
      "required": [
        "core_signing_seed",
        "desktop_read_token",
        "operator_bearer_token",
        "allocator_bearer_token",
        "dummy_cell_bearer_token",
        "dopey_cell_bearer_token"
      ],
      "properties": {
        "core_signing_seed": {
          "$ref": "#/$defs/identifier"
        },
        "desktop_read_token": {
          "$ref": "#/$defs/identifier"
        },
        "operator_bearer_token": {
          "$ref": "#/$defs/identifier"
        },
        "allocator_bearer_token": {
          "$ref": "#/$defs/identifier"
        },
        "dummy_cell_bearer_token": {
          "$ref": "#/$defs/identifier"
        },
        "dopey_cell_bearer_token": {
          "$ref": "#/$defs/identifier"
        }
      }
    },
    "role_public_keys_base64url": {
      "type": "object",
      "additionalProperties": false,
      "required": [
        "operator",
        "evaluator",
        "promoter",
        "allocator",
        "research",
        "dummy_venue",
        "dopey_venue",
        "migration"
      ],
      "properties": {
        "operator": {
          "$ref": "#/$defs/nonempty_keys"
        },
        "evaluator": {
          "$ref": "#/$defs/nonempty_keys"
        },
        "promoter": {
          "$ref": "#/$defs/nonempty_keys"
        },
        "allocator": {
          "$ref": "#/$defs/nonempty_keys"
        },
        "research": {
          "$ref": "#/$defs/nonempty_keys"
        },
        "dummy_venue": {
          "$ref": "#/$defs/nonempty_keys"
        },
        "dopey_venue": {
          "$ref": "#/$defs/nonempty_keys"
        },
        "migration": {
          "type": "array",
          "uniqueItems": true,
          "items": {
            "$ref": "#/$defs/public_key"
          }
        }
      }
    }
  },
  "$defs": {
    "nonempty_string": {
      "type": "string",
      "minLength": 1
    },
    "identifier": {
      "type": "string",
      "pattern": "^[A-Za-z0-9][A-Za-z0-9._:/-]{0,127}$"
    },
    "sha256": {
      "type": "string",
      "pattern": "^[0-9a-f]{64}$"
    },
    "public_key": {
      "type": "string",
      "pattern": "^[A-Za-z0-9_-]{43}$"
    },
    "nonempty_keys": {
      "type": "array",
      "minItems": 1,
      "uniqueItems": true,
      "items": {
        "$ref": "#/$defs/public_key"
      }
    }
  }
}
