{
  "schema": "dumbmoney.core-runner-config.v1",
  "data_root": "C:\\ProgramData\\DumbMoney\\core",
  "policy_path": "C:\\Program Files\\DumbMoney\\releases\\TO_BE_RESOLVED\\configs\\dumbmoney\\risk-policy.v1.json",
  "readiness_path": "C:\\ProgramData\\DumbMoney\\readiness\\DumbMoneyCore.json",
  "core_public_key_path": "C:\\ProgramData\\DumbMoney\\core\\keys\\core-ed25519.pub",
  "fund_lock_path": "C:\\Program Files\\DumbMoney\\releases\\TO_BE_RESOLVED\\fund.lock.json",
  "service_manifest_path": "C:\\Program Files\\DumbMoney\\releases\\TO_BE_RESOLVED\\services.v1.json",
  "release_manifest_path": "C:\\Program Files\\DumbMoney\\releases\\TO_BE_RESOLVED\\release-manifest.json",
  "bind_port": 0,
  "release_id": "TO_BE_RESOLVED",
  "fund_lock_sha256": "0000000000000000000000000000000000000000000000000000000000000000",
  "service_manifest_sha256": "0000000000000000000000000000000000000000000000000000000000000000",
  "risk_policy_sha256": "4d4845930c3f2c2b3e2844317b8eb25f9d7ea0846b40830b452b49a2df6361bf",
  "core_public_key_sha256": "0000000000000000000000000000000000000000000000000000000000000000",
  "readiness_ttl_seconds": 90,
  "processing_interval_milliseconds": 1000,
  "credential_targets": {
    "core_signing_seed": "credential-target:DumbMoney/CoreSigner",
    "desktop_read_token": "credential-target:DumbMoney/DesktopReadToken",
    "operator_bearer_token": "credential-target:DumbMoney/OperatorToken",
    "allocator_bearer_token": "credential-target:DumbMoney/AllocatorToken",
    "dummy_cell_bearer_token": "credential-target:DumbMoney/DummyCellToken",
    "dopey_cell_bearer_token": "credential-target:DumbMoney/DopeyCellToken"
  },
  "role_public_keys_base64url": {
    "operator": [
      "AQEBAQEBAQEBAQEBAQEBAQEBAQEBAQEBAQEBAQEBAQE"
    ],
    "evaluator": [
      "AgICAgICAgICAgICAgICAgICAgICAgICAgICAgICAgI"
    ],
    "promoter": [
      "AwMDAwMDAwMDAwMDAwMDAwMDAwMDAwMDAwMDAwMDAwM"
    ],
    "allocator": [
      "BAQEBAQEBAQEBAQEBAQEBAQEBAQEBAQEBAQEBAQEBAQ"
    ],
    "research": [
      "BQUFBQUFBQUFBQUFBQUFBQUFBQUFBQUFBQUFBQUFBQU"
    ],
    "dummy_venue": [
      "BgYGBgYGBgYGBgYGBgYGBgYGBgYGBgYGBgYGBgYGBgY"
    ],
    "dopey_venue": [
      "BwcHBwcHBwcHBwcHBwcHBwcHBwcHBwcHBwcHBwcHBwc"
    ],
    "migration": []
  }
}
